count,country,geo_id,tgn_or_wiki_label,label_en,label_it,label_de,label_fr,scope_note,wikidata_description,tgn_uri,wikidata_uri,country_code,gnd,tgn,viaf,notes
207977,Deutschland,00260640,Germany,Germany,Germania,Deutschland,Allemagne,"The area of north-central Europe occupied by what is now modern Germany measures some 137,828 square miles in size. Teutons, Celts, Slavs, and Balts inhabited it by the first century BCE. Part of the area was ruled by Romans, then Carolingians. Through the centuries, it was often broken into various states based on ethnic groups including the Alemanni, Bavarians, Upper and Lower Franks, Thuringians, and Frisians. It undertook expansion during the 19th to mid-20th centuries. The official language is German, although Low German is still spoken in the rural North. The 2004 estimated population was 82,633,200.",country in Central Europe,http://vocab.getty.edu/tgn/7000084,http://www.wikidata.org/entity/Q183,DE,,,,
146510,Italien,00001351,Italy,Italy,Italia,Italien,Italie,"Inhabited since 50,000 BCE; settled by Indo-Europeans 1850 BCE, Etruscans 1600 BCE, and Greeks 800 BCE; united by Romans 270 BCE; independent states rose after fall of Holy Roman Empire, notably Naples, Milan, Florence, Venice and papacy; reunited in the 19th century; official language is Italian, though significant minorities speak German, French, and Slovene.",country in Southern Europe,http://vocab.getty.edu/tgn/1000080,http://www.wikidata.org/entity/Q38,IT,,,,
36531,Frankreich,00001071,France,France,Francia,Frankreich,France,"Area inhabited by Lower Paleolithic; Celt-speaking Gauls dominated by 5th century BCE; part of Roman Empire 125 BCE-5th century, then under Frankish influence; lost land to England 12th-16th centuries; monarchy fell in Revolution 1792; recurring expansion 16-19th centuries; official language is French, though Provençal, Breton, Flemish, Catalan, Corsican, Basque, and Germanic regional patois are also spoken.",country in Western Europe,http://vocab.getty.edu/tgn/1000070,http://www.wikidata.org/entity/Q142,FR,,,,
22551,Großbritannien,20081835,United Kingdom,United Kingdom,Regno Unito,Großbritannien und Nordirland,Royaume-Uni de Grande-Bretagne et d'Irlande du Nord,"Area was inhabited by ancient Celtic-speaking peoples; invaded by Rome 55 BCE, Romans withdrew 410 CE; invaded by Angles, Saxons, and Jutes, Danes and Normans; various parts have been united by England since the 11th century; was core of large empire 18th-20th century; official language is English, though Scottish Gaelic and Welsh are also spoken.",country in north-west Europe,http://vocab.getty.edu/tgn/7008591,http://www.wikidata.org/entity/Q145,GB,,,,
10427,Österreich,00002341,Austria,Austria,Austria,Österreich,Autriche,"Austria covers an area that had Early Paleolithic settlements and an Iron Age culture by 1000 BCE. Illyrians inhabited it, then the Celts invaded ca. 400 BCE, and the Romans invaded ca. 200 BCE. Germanic tribes arrived ca. 180 CE, and Bavarians and Avars settled here from the 6th century. The area was the Eastern Mark of Charlemagne. Hapsburg rule began in 1278 and lasted until 1918, during which time it was part of the large Austro-Hungarian Empire. After World War I Austria was reduced to the German-speaking areas of the former empire. Nazi Germany annexed it in 1938, and from 1945 to 1955 it was occupied by the Allies. Since then it has become a member of the United Nations and, in 1995, of the European Union. The official language is German. Its position at the middle of Europe makes it a center of commerce, transportation, and culture.",country in Central Europe,http://vocab.getty.edu/tgn/1000062,http://www.wikidata.org/entity/Q40,AT,,,,
9707,Spanien,20080038,Spain,Spain,Spagna,Spanien,Espagne,"Area inhabited by Neanderthals 20,000 BCE, Homo Sapiens 13,000 BCE; growth of Almería culture 3000 BCE, El Argar 2000 BCE, and Tartessus 1000 BCE; colonized by Phoenicians, Greeks, Romans, and Visigoths; Muslim conquest in the 8th century; global expansion 15th-19th centurries; official language is Spanish, though Catalan, Galician, and Basque are also spoken.",country in southwestern Europe with territories in Africa,http://vocab.getty.edu/tgn/1000095,http://www.wikidata.org/entity/Q29,ES,,,,
7259,Vereinigte Staaten,00003461,United States,United States,Stati Uniti,Vereinigte Staaten,États-Unis d'Amérique,"Settled 40,000 years ago by ancestors of Amerindians; diverse cultures developed; Spanish, French, British and others settled the region from 16th century, native cultures were largely destroyed. The nation expanded westward throughout the 19th century; had Civil War in 1860s; There is no official language of the United States, though English is the most widely spoken and an official language of 31 states as of 2024. ",country primarily located in North America,http://vocab.getty.edu/tgn/7012149,http://www.wikidata.org/entity/Q30,US,,,,
5687,Griechenland,00001171,Greece,Greece,Grecia,Griechenland,Grèce,"Modern unitary multiparty republic with one legislative house. Official language is Greek, though English and French are also widely spoken. To refer specifically to the ancient confederation of Greece and its colonies, use ""Greece (ancient)""; for historical Greece in general, use ""Greece (historical).""",country in Southeast Europe,http://vocab.getty.edu/tgn/1000074,http://www.wikidata.org/entity/Q41,GR,,,,
5216,Niederlande,00002071,Netherlands,Netherlands,Paesi Bassi,Niederlande,Pays-Bas,Area was inhabited by Celtic and Germanic tribes; Romans invaded 1st century BCE; Germanic tribes invaded 5th century; ruled by Frankish Merovingians and Charlemagne; part of medieval Lotharingia; province of Spanish Hapsburgs; colonized extensively in the 17th century; official language is Dutch.,country in Northwestern Europe with territories in the Caribbean,http://vocab.getty.edu/tgn/7016845,http://www.wikidata.org/entity/Q55,NL,,,,
5035,Belgien,20080032,Belgium,Belgium,Belgio,Belgien,Belgique,"The modern kingdom of Belgium lies at the  crossroads of northeastern Europe, bounded on the northwest by the North Sea, on the north and northeast by The Netherlands, on the east by Germany, on the southeast by Luxembourg, and on the southwest and west by France. The area has historically been held by Celtic Belgae and Germanic tribes, Romans, Frankish-Merovingians, Carolingians, then various feudal states. Many independent cities evolved there in medieval times. Burgundy ruled it in the 14th century, then the Hapsburgs from 1482. Since 1831 it has been a representative, and constitutional monarchy. Densely populated and heavily urbanized, it has a rich mix of cultures. The official languages are Dutch (or Flemish), mainly spoken in the north, French, mainly spoken in the south, and German. ",country in western Europe,http://vocab.getty.edu/tgn/1000063,http://www.wikidata.org/entity/Q31,BE,,,,
4589,Schweiz,00002871,Switzerland,Switzerland,Svizzera,Schweiz,Suisse,"Area settled in pre-Christian period; had Roman encampments 1st century; Germanic tribes invaded 3rd-6th century; ruled by Franks 9th century, Holy Roman Empire from 11th century; first confederation of cantons was established 13th century, others joined 14th-19th century; official languages are German, French and Italian, though Romansch (Rhaeto-Roman) is also a national language.",country in Central Europe,http://vocab.getty.edu/tgn/7011731,http://www.wikidata.org/entity/Q39,CH,,,,
3505,Polen,00002501,Poland,Poland,Polonia,Polen,Pologne,"Poland is a republic of northeastern Europe, bordered on the east by Russia, Lithuania, Belarus, and Ukraine, on the west by Germany, on the south by the Czech Republic and Slovakia, and on the north by the Baltic Sea. However, its boundaries have changed many times over the centuries. It was settled by Slavic tribes in the 2nd millennium BCE, and over time saw incursions by Ostrogoths, Slavs, Huns and Avars. Many small states formed in the 9th century, until a united in kingdom emerged in 1025. It was part of the Polish-Lithuanian empire in the 15 and 16th centuries. It was subsequently invaded in turn by Tartars, Ottomans and Russians. Its territory shrank as it was overrun and partitioned by various European powers between the 18th and 20th centuries. Following World War II, it was dominated by the USSR and had a Communist government, which collapsed in 1989, to be followed by a Western-style democracy. The official language is Polish.",country in Central Europe,http://vocab.getty.edu/tgn/7006366,http://www.wikidata.org/entity/Q36,PL,,,,
2871,Dänemark,00000721,Denmark,Denmark,Danimarca,Dänemark,Danemark,"The nation of Denmark occupies the Jutland Peninsula, extending northwards from the center of western Europe, and some 400 islands to the east of it. It is bounded by the North Sea to the west, the Baltic Sea to the east, Germany to the south, and the strait between it and Norway and Sweden to the north. It measures some 16,639 square miles in area, not counting the independent territories of the Faeroe Islands and Greenland. The area was a seat of changing cultures in Stone, Bronze and Iron Ages. From the ninth to the eleventh centuries, Danes took part in the Viking raiding, trading, and colonizing expeditions that shaped much of Europe. The kingdom of Denmark ruled much of the Baltic Sea in the 12th and 13th centuries. The boundaries of the kingdom changed often between the 14th and19th centuries, most recently in 1920. The late 19th century saw a time of depression in which Danish farmers established cooperatives and the rural population became highly literature as a result of the establishment of folk high schools. The Danish tradition of social cooperation and humane governmental institutions began around this time. Denmark was occupied militarily by Germany in World War II, but resisted with some success until the local government fell in 1943; organized resistance continued however until freedom in May of 1945. The official language is Danish, a derivative of Old Scandinavian, though English and German are also spoken. Agriculture is an important economic activity, with 60% of the land under intense cultivation, about half of that devoted to grains such as wheat and barley. The raising of sugar beets and of domestic livestock such as dairy cattle, poultry, and swine are also very important. Fishing is done in the North and Baltic Seas as well as in foreign waters far abroad. Mineral exploitation consists largely of the mining of granite, kaolin, and various clays used in the production of building materials. The major manufactures are of electronic equipment, paper, machinery and equipment, processed foods, footwear, clothing, and furniture.  The capital city is Copenhagen on the island of Zeeland. The 2004 estimated population was 5,405,600.",country in Northern Europe,http://vocab.getty.edu/tgn/1000066,http://www.wikidata.org/entity/Q35,DK,,,,
2522,Vatikanstaat,,Vatican City,Holy See,Santa Sede,Vatikanstadt,Saint-Siège,"Papal sovereign state located within Rome, Italy; was long the headquarters of the Papal States, which had varying boundaries from 3rd-20th centuries; flourished particularly during Medieval, Renaissance and Baroque periods; was occupied by Italy in 1870.","Holy See's independent state, an enclave within Rome, Italy",http://vocab.getty.edu/tgn/7001168,http://www.wikidata.org/entity/Q237,VA,,,,
2512,Tschechien,20913879,Czech Republic,Czech Republic,Cechia,Tschechische Republik,République tchèque,"The Czech Republic lies in central Europe, occupying the traditional lands of Moravia and Bohemia, plus a southwestern piece of Silesia. It is bounded by Poland to the north, Germany to the west, Slovakia to the east, and Austria to the south. Since at least 4000 BCE it has been settled and farmed. The Celtic Boii, or Bohemian, inhabitants were supplanted by Slavs and Germanic tribes. Slavic Czechs were dominant by the 9th century. The area was part of the Přemysl kingdom from 895 to 1306. It was ruled by the Hapsburgs from 1526. It was integrated into Czechoslovakia after WW I. From 1948 to 1989, a Communist government was in control. The modern republic was created as of January 1, 1993. Major industries include electronics, engineering, food processing, and iron and steel manufacturing. The main language is Czech, though Slovak, Polish, and German are also spoken. The capital city is Prague. It measures some 30,450 square miles in area, and it 2003 estimated population was 10, 290,000.",country in Central Europe,http://vocab.getty.edu/tgn/1001780,http://www.wikidata.org/entity/Q213,CZ,,,,
2010,Ägypten,00000011,Egypt,Egypt,Egitto,Ägypten,Égypte,"Area of modern Egypt comprises the core of the ancient kingdom of Egypt; area was home to Neolithic cultures by 6000 BCE; Thinite dynasty united Upper and Lower Egypt ca. 3100 BCE; important Hellenistic center; part of Roman Empire until Arab conquest in 640, then Mameluk and Ottoman; official language is Arabic, though English and French are also widely spoken.",country in Northeast Africa and Southwest Asia,http://vocab.getty.edu/tgn/7016833,http://www.wikidata.org/entity/Q79,EG,,http://vocab.getty.edu/tgn/7016833,,
1713,Russland,00002671,Russia,Russia,Federazione Russa,Russische Föderation,Fédération de Russie,"Area was inhabited by many early cultures including Scythians (7th century BCE), Sarmatians, Goths (3rd century CE), Huns, Avars, Khazars, Bulgars, and Slavs; Varangians (Scandinavians) created Russian state in the 9th century; was core of large empire and Soviet Union (1922); official language is Russian.",country in Eastern Europe and Northern Asia,http://vocab.getty.edu/tgn/7002435,http://www.wikidata.org/entity/Q159,RU,,,,
1286,Portugal,20080039,Portugal,Portugal,Portogallo,Portugal,Portugal,"Portugal is a nation located on the Atlantic coast of the Iberian Peninsula, bordered on the east and north by Spain and on the west and south by the Atlantic Ocean. Inhabited by 500,000 BCE; distinct cultures began to emerge by the 6th millennium. BCE. Celts, later called Lusitanians, invaded in the 1st millennium BCE. It was ruled by Romans by the 2nd century BCE, then was occupied successively by the Germanic Suebi, the Visigoths in the 5th century CE, and the Moors by 711. It became a separate kingdom in the 12th century, and began expanding globally with colonies in South America, Africa, and the Far East from the 14th to the 17th centuries. From 1580 to 1640 it was ruled by Spain. In 1640 the House of Bragança reestablished a native Portuguese kingdom that lasted until 1910, though it suffered much turbulence, especially during the period of the Napoleonic wars. A republic was established in 1910, since when the nation has undergone rule by various dictators. A constitution and free elections were established in 1976. It joined the European Union in 1986. ",country in Southwestern Europe,http://vocab.getty.edu/tgn/1000090,http://www.wikidata.org/entity/Q45,PT,,,,
1219,Syrien,00003201,Syria,Syria,Siria,Syrien,République arabe syrienne,"Earliest inhabitants of the area were probably Natufians ca. 10,000 BCE; home to several great cultures, including Akkadians and Amorites 3rd-2nd millenia BCE; ruled by Alexander, Romans, Arabs, and Ottomans; shares name with ancient region covering a wider area; official language is Arabic.",country in West Asia,http://vocab.getty.edu/tgn/1000140,http://www.wikidata.org/entity/Q858,SY,,,,
1113,Türkei,00003351,Turkey,Turkey,Turchia,Türkei,Turquie,"Indigenous Anatolian peoples were invaded by Indo-European Hittites, forming empire ca. 1900 BCE; ruled by Persians 6th century BCE, then Greeks, then Romans 1st century BCE; settled by Turks from central Asia 11th century; was heart of Ottoman Empire 13th-19th centuries; official language is Turkish.",country in West Asia and Southeast Europe,http://vocab.getty.edu/tgn/1000144,http://www.wikidata.org/entity/Q43,TR,,,,
1074,Estland,20913278,Estonia,Estonia,Estonia,Estland,Estonie,"Settled by prehistoric Finno-Ugric tribes; traded with Rome and German tribes 1st-6th century CE; invaded by Vikings 9th century, by Russians 11th century; ruled by Danes in the north and Germans in the south in 13th century, by Livonian Order 14th century, by Sweden and Russia 16th-18th century; official language is Estonian.",country in Northern Europe,http://vocab.getty.edu/tgn/7006540,http://www.wikidata.org/entity/Q191,EE,,,,
1037,Schweden,00002841,Sweden,Sweden,Svezia,Schweden,Suède,"European hunters arrived here 12,000 BCE; settled by Svear, Lapps, Herules, Danes, and Goths first millenium BCE; controlled eastern trade route to Byzantium and Baghdad during Viking Era, colonized Russia; united with Denmark and Norway 14th-16th centuries, with Norway 19th century; official language is Swedish, though Finnish is also spoken.",country in Northern Europe,http://vocab.getty.edu/tgn/1000097,http://www.wikidata.org/entity/Q34,SE,,,,
886,Armenien,00000141,Armenia,Armenia,Armenia,Armenien,Arménie,"The country today known as Armenia was once part of ancient Armenia, considered an advanced ancient culture, which extended from the Black Sea to the Caspian Sea, and from the Mediterranean to Lake Urmia in Iran. Ancient Armenia was incorporated into the Achaemenian Empire of Persia (from the 6th-4th century BCE), and later into the Macedonian Empire (from 330 BCE). Under Roman rule in the 2nd century BCE, a Greater Armenia was formed. Over the following centuries, the area was conquered by Persians, Byzantines, and Arabs. In the 11th century CE, a second Armenian state was formed in the Cicilian Plane, to the west. Greater Armenia was the subject of several power struggles until it lost its autonomy in the 14th century. Eastern Armenia was appended to Russia in the 19th century. Western Armenia was controlled by Turkey, and in the late-19th to the early-20th centuries, the country's populace was the subject of massacres and deportations by the Turks. In 1920, the Soviet Republic of Armenia was established, later dissolving in 1936, with Armenia becoming a separate constituent republic of the Soviet Union. In 1991, Armenia declared independence from the Soviet Union. Although the Soviets had helped to modernize the country, the 1990s brought an economic crisis which has seen a fifth of the population emigrate. Major industries in Armenia include chemicals, clothing, and machinery, as well as textiles. ",sovereign state in the South Caucasus region of Eurasia,http://vocab.getty.edu/tgn/7006651,http://www.wikidata.org/entity/Q399,AM,,,,
856,Georgien,20913819,Georgia,Georgia,Georgia,Georgien,Géorgie,"Area contained ancient kingdoms of Colchis and Iberia; taken by Rome 64 BCE; became Christian 4th century; ruled by Persia (ca. 555) and Arabs (8th century); invaded by Armenians, Mongols, and Turks (1071 and 1600); annexed to Russia 1801; part of Soviet Union from 1922; official language is Georgian.",country in the Caucasus,http://vocab.getty.edu/tgn/7006653,http://www.wikidata.org/entity/Q230,GE,,,,
758,Ungarn,00003381,Hungary,Hungary,Ungheria,Ungarn,Hongrie,"Agriculture developed by 4th millennium BCE; part of Roman Pannonia and Dacia, inhabited by Illyrians and Celts; held by Avars 7th-9th century, then Charlemagne; Finno-Ugrian Magyars invaded, defeated by Otto I 955; held by Mongols and Turks; Austria-Hungary formed 1867; official language is Magyar (Hungarian), though German, Slovak, Romanian and other languages are also spoken. As of 2014, Hungary is divided into 19 counties, 23 ""urban counties"" which are also primary subdivisions, and 1 ""special city"" (Budapest). ",country in Central Europe,http://vocab.getty.edu/tgn/7006278,http://www.wikidata.org/entity/Q28,HU,,,,
613,Albanien,20913803,Albania,Albania,Albania,Albanien,Albanie,"Albania has been inhabited by Illyrians (ancient Indo-Europeans) from 1000 BCE. The south was colonized by Greece, and the north ruled by local kings. It was part of the Roman province of Illyricum, after which it was ruled by Constantinople. In the 6th century CE, Visigoths, Huns, and Slavs invaded it. From the 14th century until 1912, it was ruled by the Ottoman Empire. The official language is Albanian, which is derived from the ancient Illyrian language. ",country in southeastern Europe,http://vocab.getty.edu/tgn/7006417,http://www.wikidata.org/entity/Q222,AL,,,,
570,Lettland,20913841,Latvia,Latvia,Letonia,Lettland,Lettonie,"Inhabited by prehistoric Finno-Ugric tribes; traded with Rome and German lands 1st-6th century CE; settled by Baltic Latgallians; battled expanding Scandinavian and Slavic tribes 8th-11th centuries; ruled by Livonia (13th century-1561), Poland, Germany, and Russia; official language is Latvian.",sovereign state in northeastern Europe,http://vocab.getty.edu/tgn/7006541,http://www.wikidata.org/entity/Q211,LV,,,,
548,Liechtenstein,20091227,Liechtenstein,Liechtenstein,Principato del Liechtenstein,Liechtenstein,Liechtenstein,"Small Alpine nation located between Switzerland and Austria; most inhabitants are descendants of Alemmani tribe that immigrated in 5th century, while others, Walsers, descended from 13th-century immigrants from Swiss Valais; official language is German, though most inhabitants speak an Alemmanic dialect.",country in Central Europe,http://vocab.getty.edu/tgn/7003515,http://www.wikidata.org/entity/Q347,LI,,,,
482,Kanada,00260653,Canada,Canada,Canada,Kanada,Canada,"Inhabited by ancestors of Amerindians and Inuit in Upper Palaeolithic or earlier; evolved diverse cultures over vast area; Norse settlements by 1000 CE; English, French, Spanish, and Portuguese claimed territory from the 16th century; under British control from 1759; official languages are English and French.",country in North America,http://vocab.getty.edu/tgn/7005685,http://www.wikidata.org/entity/Q16,CA,,,,
354,Kroatien,20913838,Croatia,Croatia,Croazia,Kroatien,Croatie,"Area was part of ancient Pannonia; settled by Slavic Croats from Ukraine 7th century CE; formed kingdom in 10th century; ruled by Hungary 1091-1526, then by Turks until late 17th century; was part of Austria-Hungary; was part of Yugoslavia from 1929; official language is Croatian.",country in Central Europe,http://vocab.getty.edu/tgn/7006663,http://www.wikidata.org/entity/Q224,HR,,,,
280,Norwegen,00002201,Norway,Norway,Norvegia,Norwegen,Norvège,"Area inhabited by 5000 BCE; new migrants arrived 3000 BCE; contact with Roman-occupied Gaul 1st century; ruled by chieftans from 4th century, states established 9th century; Vikings colonized Greenland and North America 9-11th centuries; joined with Sweden and Denmark 1389-1814; official language is Norwegian, which is in use in 2 forms, Bokmål Norwegian, and Nynorsk Norwegian.",country in Northern Europe,http://vocab.getty.edu/tgn/1000088,http://www.wikidata.org/entity/Q20,NO,,,,
277,Deutschland?,,Germany,Germany,Germania,Deutschland,Allemagne,"The area of north-central Europe occupied by what is now modern Germany measures some 137,828 square miles in size. Teutons, Celts, Slavs, and Balts inhabited it by the first century BCE. Part of the area was ruled by Romans, then Carolingians. Through the centuries, it was often broken into various states based on ethnic groups including the Alemanni, Bavarians, Upper and Lower Franks, Thuringians, and Frisians. It undertook expansion during the 19th to mid-20th centuries. The official language is German, although Low German is still spoken in the rural North. The 2004 estimated population was 82,633,200.",country in Central Europe,http://vocab.getty.edu/tgn/7000084,http://www.wikidata.org/entity/Q183,DE,,,,
240,Irak,00260697,Iraq,Iraq,Iraq,Irak,Iraq,"Area was center of civilization from 10th mill. BCE; Sumerians arrived 3500 BCE; Akkadian empire developed 2350 BCE, then Babylonian (18th century BCE) and Assyrian (7th century BCE); was invaded by Persians, Alexander, Romans, Byzantines, Arabs (7th century) and Ottomans; official language is Arabic, though English is also widely spoken; Kurdish is official language in Kurdish Autonomous Region.",sovereign state in Western Asia,http://vocab.getty.edu/tgn/1000118,http://www.wikidata.org/entity/Q796,IQ,,,,
174,Monaco,20913851,Monaco,Monaco,Monaco,Monaco,Monaco,"Small nation located on Mediterranean Riviera; area had Stone Age settlements; known to Phoenicians, Greeks, Carthaginians and Romans; Genoese claimed it in 1191; Grimaldi family reign began in 1297 and continues today; generally has been allied with France; official language is French, though Italian is also spoken.",sovereign city-state on the French Riviera,http://vocab.getty.edu/tgn/7005758,http://www.wikidata.org/entity/Q235,MC,,,,
151,Rumänien,00260602,Romania,Romania,Romania,Rumänien,Roumanie,"Area inhabited by Illyrians, Thracians and Scythians 1st millenium BCE; Greeks settled in 7th century BCE, and Dacians in 4th century BCE; subjugated by Rome, then by Goths; divided into states, including Walachia and Moldavia by 14th century; vassal of Ottomans 14-19th centuries; official language is Romanian.",country in Southeast Europe,http://vocab.getty.edu/tgn/1000091,http://www.wikidata.org/entity/Q218,RO,https://d-nb.info/gnd/4050939-4,,https://viaf.org/viaf/124251001,
138,Israel & Staat Palästina,,,,,,,,,,,,,,,
112,Slowakei,00260603,Slovakia,Slovakia,Slovacchia (Repubblica Slovacca),Slowakei,Slovaquie,"Inhabited by agriculturists by 5th millennium BCE; settled by Illyrian, Celtic and Germanic tribes from 1st century CE; Slavic Slovaks (akin to Czechs) entered from Silesia 6th century; ruled by Hungary 11th century, later by Hapsburgs; part of Czechoslovakia after WW I; main language is Slovak, though Czech, Hungarian and Ukrainian are also spoken.",country in Central Europe,http://vocab.getty.edu/tgn/7011765,http://www.wikidata.org/entity/Q214,SK,,,,
