count,country,geo_id,tgn_or_wiki_label,label_en,label_it,label_de,label_fr,scope_note,wikidata_description,tgn_uri,wikidata_uri,country_code,gnd,tgn,viaf,notes
1,Eritrea,20914064,Eritrea,Eritrea,Eritrea,Eritrea,Érythrée,"The area was part of the ancient Ethiopian kingdom of Axum before the 7th century, and was claimed by Ottomans in the 16th century. In the 19th century it was claimed by Egypt and Italy. From the 1960s, it was part of the modern nation of Ethiopia from, but secessionists fought for independence. Major languages include Arabic, Italian, Tigrinya, Tigre, Saho, and Danakili.",country in the Horn of Africa,http://vocab.getty.edu/tgn/7001658,http://www.wikidata.org/entity/Q986,ER,,,,
1,Frankreich?,,France,France,Francia,Frankreich,France,"Area inhabited by Lower Paleolithic; Celt-speaking Gauls dominated by 5th century BCE; part of Roman Empire 125 BCE-5th century, then under Frankish influence; lost land to England 12th-16th centuries; monarchy fell in Revolution 1792; recurring expansion 16-19th centuries; official language is French, though Provençal, Breton, Flemish, Catalan, Corsican, Basque, and Germanic regional patois are also spoken.",country in Western Europe,http://vocab.getty.edu/tgn/1000070,http://www.wikidata.org/entity/Q142,FR,,,,
1,Großbritannien / Irland,,,,,,,,,,,,,,,
1,Großbritannien?,,United Kingdom,United Kingdom,Regno Unito,Großbritannien und Nordirland,Royaume-Uni de Grande-Bretagne et d'Irlande du Nord,"Area was inhabited by ancient Celtic-speaking peoples; invaded by Rome 55 BCE, Romans withdrew 410 CE; invaded by Angles, Saxons, and Jutes, Danes and Normans; various parts have been united by England since the 11th century; was core of large empire 18th-20th century; official language is English, though Scottish Gaelic and Welsh are also spoken.",country in north-west Europe,http://vocab.getty.edu/tgn/7008591,http://www.wikidata.org/entity/Q145,GB,,,,
1,Kuba,20913839,Cuba,Cuba,Cuba,Kuba,Cuba,"Comprises a large island of the same name and several smaller islands; area was inhabited by Ciboney, Guanahatabey and Taino (Arawaks) when Columbus arrived in 1492; Spanish colonized in 1511, native people soon died; Africans were brought here as slaves for plantations; official language is Spanish.",sovereign state situated on an island in the Caribbean Sea,http://vocab.getty.edu/tgn/7004624,http://www.wikidata.org/entity/Q241,CU,,,,
1,Montenegro,20200796,Montenegro,Montenegro,Montenegro,Montenegro,Monténégro,"Former southwest republic of Yugoslavia; inhabitants speak Serbo-Croatian; economy based on oil drilling, mining, forestry, and cottage industries; takes its name from Italian Monte Nero (Black Mountain); suffered centuries of warfare with Turks.",country in southeastern Europe,http://vocab.getty.edu/tgn/7015657,http://www.wikidata.org/entity/Q236,ME,,,,
1,Niederlande / Belgien,,,,,,,,,,,,,,,
1,Palästinensische Autonomiegebiete,,,,,,,,,,,,,,,
1,Philippinen,20913863,Philippines,Philippines,Filippine,Philippinen,Philippines,"Comprises over 7000 islands; area first settled by Negritos (a pygmy group) by 30,000 BCE; later settled by Malayans; Islam introduced by Arabs 14th century; Spanish conquest began 1564, endured conflict with Moros of South and Chinese; revolution 1896-1899; official languages are Pilipino and English.",archipelagic country in Southeast Asia,http://vocab.getty.edu/tgn/1000135,http://www.wikidata.org/entity/Q928,PH,,,,
1,Polen & Deutschland,,,,,,,,,,,,,,,
1,Thailand,20913876,Thailand,Thailand,Thailandia,Thailand,Thaïlande,"Area has been inhabited continuously for 20,000 years; was part of ancient Mon-Khmer kingdom; separate state was formed by Thai people ca. 1350; had territorial disputes with Burma 15th-18th centuries; some territory seized by British and French 18th-19th centuries; official language is Thai, though many local dialects are also spoken.",country in Southeast Asia,http://vocab.getty.edu/tgn/1000142,http://www.wikidata.org/entity/Q869,TH,,,,
1,Tunesien,00260695,Tunisia,Tunisia,Tunisia,Tunesien,Tunisie,"Shares name with historic Barbary state and Roman province; area had Phoenician settlements 12th century BCE; part of Carthaginian kingdom 6th century BCE; in French control late 19th century, leading to Italy's accession to Triple Alliance in 1882; official language is Arabic, though French is also widely spoken.",country in North Africa,http://vocab.getty.edu/tgn/1000205,http://www.wikidata.org/entity/Q948,TN,,,,
1,Uruguay,20913880,Uruguay,Uruguay,Uruguay,Uruguay,Uruguay,Early inhabitants were Amerindian tribes known collectively as Charrúas; they were nearly all exterminated during European colonization; Spain arrived 1516; Portuguese settled 1680; was part of Spanish Viceroyalty of Río de la Plata late 18th century; official language is Spanish.,sovereign state in South America,http://vocab.getty.edu/tgn/1000058,http://www.wikidata.org/entity/Q77,UY,,,,
1,Vereinigte Staaten / Großbritannien,,,,,,,,,,,,,,,
1,Weißrussland,20913751,Belarus,Belarus,Bielorussia,Belorussland,Bélarus,"Colonized by East Slavic tribes 5th-8th centuries CE; ruled by Kiev from 9th century; divided into several principalities 12th century; Mongols invaded 13th century; ruled by Lithuanians and Poles from 14th century, by Russia from 18th century; part of Soviet Union from 1922; official language is Belorussian.",country in Eastern Europe,http://vocab.getty.edu/tgn/7006657,http://www.wikidata.org/entity/Q184,BY,,,,
1,Ägypten / Sudan,,,,,,,,,,,,,,,