count,country,region,tgn_or_wiki_label,label_en,label_it,label_de,label_fr,type,scope_note,wikidata_description,tgn_uri,wikidata_uri
27,England,Co. Durham,Durham,Durham,,,,counties,"Administrative, geographic, and historic county in northeastern England on the North Sea coast. It comprises two upland regions, lowlands of Wear valley, and limestone plateaus. The administrative county comprises seven districts: Chester-le-Street, Derwentside, the city of Durham, Easington, the borough of Sedgefield, Teesdale, and Wear Valley. The geographic county includes the entire administrative county, the unitary authorities of Darlington and Hartlepool, and the part of the unitary authority of Stockton-on-Tees (including the historic core of Stockton) north of the River Tees. The historic county includes the entire geographic county except for the part of the Teesdale district south of the River Tees, which belongs to the historic county of Yorkshire. The metropolitan boroughs of Gateshead, South Tyneside, and Sunderland in the metropolitan county of Tyne and Wear also belong to the historic county of Durham. The region was inhabited by agricultural peoples from Neolithic times through the Iron Age. Durham was incorporated into the Saxon kingdom of Northumbria during the 6th century. The region became important economically when it became a center for coal-mining and other heavy industry in the 19th century. Durham county was the site of the world's first passenger railway, which began running between Stockton and Darlington in 1825. The county suffered economic depression between World Wars I and II.",,http://vocab.getty.edu/tgn/7008127,
27,United States,Arkansas,Arkansas,Arkansas,Arkansas,Arkansas,Arkansas,states,"Area was home to Bluff Dwellers by 500 BCE, later to Mound Builders; Caddo, Quapaw, and others lived here when European fur traders arrived in 17th century; in Louisiana Purchase of 1803; was slave state, but only reluctantly joined Confederacy in Civil War.",state of the United States of America,http://vocab.getty.edu/tgn/7016172,http://www.wikidata.org/entity/Q1612
26,Italy,Campania,Campania,Campania,Campania,Kampanien,Campanie,regions,"Administrative region of Italy. Productive agricultural area from ancient times; settled by Etruscans; taken by Samnites 5th century BCE, supported Greek colonies along coast; was Roman from 4th century BCE; later ruled by Goths, Byzantines, Lombards, and Normans; part of Two Sicilies from 1282.",region in Southern Italy,http://vocab.getty.edu/tgn/7003005,http://www.wikidata.org/entity/Q1438
26,United States,New Mexico,New Mexico,New Mexico,Nuovo Messico,,Nouveau-Mexique,states,"Inhabited by 8,000 BCE; Anasazi & ancestors of Pima & Papago lived here by 12-13th cen. CE; Navajo & Apache arrived here from N by 15th cen.; Spanish arrived 16-17th cen.; area went to Mexico in 1821, to USA in 1848 in Mexican War; with Union in Civil War.",state of the United States of America,http://vocab.getty.edu/tgn/7007566,http://www.wikidata.org/entity/Q1522
24,Scotland,Selkirkshire,Selkirkshire,Selkirkshire,,,,second level subdivisions,,,http://vocab.getty.edu/tgn/7448930,
23,,Massachusetts,Massachusetts,Massachusetts,,,Massachusetts,states,Settled by Amerindians by 2nd mill. BCE; Norsemen may have landed here in 1003; Europeans fished here in 16th cen.; Plymouth Colony established by English in 1620; played key role in Revolution; was intellectual center of nation until mid-19th cen.,state of the United States of America,http://vocab.getty.edu/tgn/7007517,http://www.wikidata.org/entity/Q771
23,England,Hertfordshire,Hertfordshire,Hertfordshire,,,,counties,"Located in southeastern England, north of Greater London; drained by rivers Lea and Colne. It contains Neolithic, Bronze Age and Roman remains, a Norman castle, and many large country estates; expanded greatly in the 20th century to accomodate population and industrial overflow from London. The county is divided into ten districts.",,http://vocab.getty.edu/tgn/7008145,
23,England,Kent,Kent,Kent,,,,counties,"Comprises chalk cliffs, grasslands and woodlands; inhabited since prehistoric times; settled by Romans ca. 43; invaded by Jutes and Saxons in the 5th century; in Middle Ages, pilgrims came to Canterbury and Rochester cathedrals; famous for its fruits and vegetables.","ceremonial county of England, United Kingdom",http://vocab.getty.edu/tgn/7008153,http://www.wikidata.org/entity/Q23298
23,Italy,Minnesota,,,,,,,,,,
22,,Pennsylvania,Pennsylvania,Pennsylvania,,,Pennsylvanie,states,"Occupied mainly by Algonquian, with Iroquoian-speakers in E, when English, Dutch and Swedes settled here 17th cen.; haven for religious dissenters founded by W Penn in 1682; suffered battles in French and Indian wars; was strongly pro-Revolution and pro-Union.",state of the United States of America,http://vocab.getty.edu/tgn/7007710,http://www.wikidata.org/entity/Q1400
22,Canada,British Columbia,British Columbia,Province of British Columbia,Columbia Britannica,,Province de Colombie-Britannique,provinces,"Visited by Sir Francis Drake 1578-1579, Juan de Fuca 1592 and Captain Cook 1778; coast was surveyed by Captain George Vancouver 1790s; nation's most mountainous province; products include lumber, copper, zinc, lead, molybdenum, iron ore, natural gas and oil.",province of Canada,http://vocab.getty.edu/tgn/7005735,http://www.wikidata.org/entity/Q1973
22,England,Buckinghamshire,Buckinghamshire,Buckinghamshire,,,,counties,"Inhabited by Neolithic peoples, Romans and Saxons; part of kingdom of Mercia; many great estates were built here after clearance of woodlands in 17th century; furniture and printing began after WW II.",,http://vocab.getty.edu/tgn/7008104,
22,England,Shropshire,Shropshire,Shropshire,,,,counties,"Comprises river valleys, low ridges and plains; remains include several Late Neolithic and Early Bronze Age objects and a 1st-century Roman fortress; was long object of English-Welsh border disputes; large iron-producing area since Industrial Revolution; the world's first cast-iron bridge was built at Ironbridge in 1779; the area is now mainly agricultural. The rapidly developing area around Telford new town became an independent unitary authority (Telford and Wrekin) in 1998. ",,http://vocab.getty.edu/tgn/7012034,
21,,Connecticut,Connecticut,Connecticut,Connecticut,Connecticut,Connecticut,states,"Originally inhabited by 16 tribes of Algonquian Indians; Dutchman, A Block, was first European in the area; English arrived in 1633, battled with Amerindians & Dutch; area provided supplies for Revolution; characterized today by rural & shore communities.",state of the United States of America,http://vocab.getty.edu/tgn/7007159,http://www.wikidata.org/entity/Q779
21,England,Nottinghamshire,Nottinghamshire,Nottinghamshire,,,,counties,"County in the East Midlands of England, on the east slope of the Pennine Mountains. Sherwood Forest, haunt of legendary Robin Hood, is located north of Nottingham city. Farmland and dairies in Vales of Trent and Belvoir are famous for Stilton cheese; coal measures and small mining towns characterize the west. The main industrial town is Nottingham, an independent unitary authority since 1998.",ceremonial county of England,http://vocab.getty.edu/tgn/7008167,http://www.wikidata.org/entity/Q23092
20,,Maryland,Maryland,Maryland,Maryland,Maryland,Maryland,states,"Occupied by roving hunters by ca. 8000 BC, later was home to agrarian cultures; Algonquian-speakers, at war with Iroquois to N, lived here when Europeans settled in 17th cen.; fought in Revolution; state had split loyalties in Civil War.",state of the United States of America,http://vocab.getty.edu/tgn/7007516,http://www.wikidata.org/entity/Q1391
20,Italy,Umbria,Umbria,Umbria,Umbria,Umbrien,Ombrie,regions,"Was home of ancient Umbri tribes, who spoke an Indo-European dialect and were concentrated here to escape Etruscan and Gallic pressure during 1st mill. BCE; later held by Romans, Lombards and Byzantines; city-states developed; went to Papal States in the 16th century.",region of Italy,http://vocab.getty.edu/tgn/7003125,http://www.wikidata.org/entity/Q1280
19,England,Cheshire,Cheshire,,,,,counties,"Ceremonial county in northwestern England. Geologically comprises fragmented areas of clay, sand and gravel, dotted with rivers and small lakes. Site of ancient hill forts on mid-Cheshire ridge during Bronze and Iron Ages; famous for cheese and well-preserved half-timbered houses.","ceremonial county in England, United Kingdom",http://vocab.getty.edu/tgn/7008114,http://www.wikidata.org/entity/Q23064
19,England,Northamptonshire,Northamptonshire,Northamptonshire,,,,counties,"Comprises wooded hills and river valleys; has pre-Celtic and Roman remains; boundries almost identical to those laid down in 1096; scene of several battles during Civil War (1642-1645); industries include engineering, shoe-manufacturing, and food-processing.",,http://vocab.getty.edu/tgn/7012031,
19,United States,Puerto Rico,Puerto Rico,Puerto Rico,Portorico,Puerto Rico,Porto Rico,unincorporated territories,"Earliest inhabitants immigrated from Florida or Orinoco basin of South America; was inhabited by Arawaks under threat from Caribs when Columbus visited in 1493; Spanish settlers wiped out Arawaks, brought Africans here as slaves for gold mines & plantations; official language is Spanish, though English is also spoken. Puerto Rico does not have first-order administrative divisions according to CIA World Factbook, instead at the second order it has 78 municipalities.",unincorporated territory of the United States of America,http://vocab.getty.edu/tgn/7004643,http://www.wikidata.org/entity/Q1183
18,,New Jersey,New Jersey,New Jersey,,,New Jersey,states,"Was summer home of Delaware (Lenni Lenape) Indians when Dutch, English, Scots-Irish and Swedes settled here in 17th cen.; Tory activity and several battles occurred in area during Revolution; sentiment was mainly pro-Union in Civil War.",state of the United States of America,http://vocab.getty.edu/tgn/7007565,http://www.wikidata.org/entity/Q1408
18,England,Norfolk,Norfolk,Norfolk,,,,counties,"Low-lying area crossed by rivers Yare, Wensum, and Bure; noted for Paleolithic, Mesolithic, and Neolithic remains; occupied by British Inceni people in the 3rd century; was wealthy and densely populated in the 11th century; economy based on food-processing, fishing, and shoes.","county in East Anglia, England, UK",http://vocab.getty.edu/tgn/7008160,http://www.wikidata.org/entity/Q23109
17,,California,California,California,,Kalifornien,Californie,states,"Inhabited by many ethnic nationalities including Mojave, Yuma and Chumash when Spanish arrived in 16th cen.; Franciscans established missions all along coast; went to Mexico in 1820s; went to US in 1848; great influx of settlers from E arrived in gold rush.",state of the United States of America,http://vocab.getty.edu/tgn/7007157,http://www.wikidata.org/entity/Q99
17,United States,West Virginia,West Virginia,West Virginia,Virginia Occidentale,,Virginie-Occidentale,states,"Inhabited by mammoth-hunters 12,000 BCE, by Archaic People 9,000 BCE and Mound Builders ca. 500 BCE, then Fort Ancient people; Iroquois League dominated by 1650; Europeans settled in 17th-18th cen.; invaded by British during Revolution; pro-Union in Civil War.",state of the United States of America,http://vocab.getty.edu/tgn/7013961,http://www.wikidata.org/entity/Q1371
16,Italy,Marche,Marche,Marches,Marche,Marken,Marches,regions,"Inhabited early by Umbri and Picentes people; colonized by Greeks, later by Romans (3rd century BCE); invaded by Goths 5th century CE; portions ruled by Byzantines and Lombards; ruled by Pope in 8th century and again from the 13th century.",region in Italy,http://vocab.getty.edu/tgn/7003240,http://www.wikidata.org/entity/Q1279
15,England,Yorkshire,Yorkshire,Yorkshire,,,,general regions,"Area in north-central England between the Pennines and the North Sea. Formerly a large county. The region is composed of four broad belts of land stretching from north to south: in the west the high Pennine moorlands dissected by the Yorkshire Dales; in the southeast the central lowlands (including the Vale of York) draining into the River Humber estuary; in the east the North York Moors and Yorkshire Wolds; and, farther southeast, the Holderness plain along the North Sea. Site of prehistoric remains, including earthworks at Stanwick; it was a Roman military stronghold 1st-5th centuries CE. Controlled by indigenous Britons, then part of the kingdom of Deira from the 6th-9th centuries. It was taken by Danes 875 and recaptured by kings of Wessex 954. The region remained strongly Anglo-Scandinavian in culture until the Normans took control in 1069. Important monasteries and estates were established. After the Black Death of the 14th century, most of Yorkshire's crop land became pasture for sheep and woolen manufacture became an important industry. It was the base for Yorkists during War of the Roses (1455-1485) and two of the most important battles were fought here (Wakefield and Towton, 1460 and 1461). The battle at Marston Moor in 1644 was one of the most crucial of the English Civil Wars. Architecture in Yorkshire includes pre-Norman churches; abbeys such as the ruined Rievaulx; castles such as Bolton; the Gothic York Minster; and notable country houses such as 18th-century Castle Howard.",historic county of England,http://vocab.getty.edu/tgn/7008171,http://www.wikidata.org/entity/Q163
14,,South Carolina,South Carolina,South Carolina,Carolina del Sud,,Caroline du Sud,states,"Inhabited by Cusabo, Creek, Congaree and others when Spanish, French & English arrived 16-17th cen.; Europeans penetrated inland in 18th cen.; strongly supported the American Revolution; was slave state, the first to join Confederacy in 1860 in Civil War.",state of the United States of America,http://vocab.getty.edu/tgn/7007712,http://www.wikidata.org/entity/Q1456
14,Australia,VIC,Victoria,Victoria,,,,states,Charted by Captain Cook in 1770; settled by Tasmanian immigrants 1835; separated from New South Wales 1851; gold was discovered in the Ballarat region in 1851.,state of Australia,http://vocab.getty.edu/tgn/7006238,http://www.wikidata.org/entity/Q36687
14,England,Northampton,Northamptonshire,Northamptonshire,,,,counties,"Comprises wooded hills and river valleys; has pre-Celtic and Roman remains; boundries almost identical to those laid down in 1096; scene of several battles during Civil War (1642-1645); industries include engineering, shoe-manufacturing, and food-processing.",,http://vocab.getty.edu/tgn/7012031,
14,United States,Idaho,Idaho,Idaho,,,Idaho,states,"Inhabited by 8000 BC; Kutenai, Coeur d'Alene, Nez Percé, Paiute, Shoshoni & others were here when influx of settlers from E destroyed buffalo herds in 19th cen.; conflict with Britain over N border 1840s; received Confederate refugees after Civil War.",state of the United States of America,http://vocab.getty.edu/tgn/7007250,http://www.wikidata.org/entity/Q1221
14,United States,Wyoming,Wyoming,Wyoming,,,Wyoming,states,"Inhabited before 9,000 BCE; home to Crow, Ute, Bannock, Blackfoot, Cheyenne, Comanche, Kiowa and Dakota in modern times, only Shoshoni and Arapaho survived by 1890s; most Europeans arrived 19th cen.; area came to USA with Louisiana Purchase and after Mexican War.",state of the United States of America,http://vocab.getty.edu/tgn/7007923,http://www.wikidata.org/entity/Q1214
12,,District of Columbia,District of Columbia,District of Columbia,,"Washington, D.C.",District de Columbia,national districts,"Federal district coextensive with city of Washington; US was first nation to plan a capital exclusively for seat of government; originally was a 10-mile square in Maryland & Virginia, on both banks of Potomac river; Virginia reclaimed its land in 1846.","federal district of the United States of America, containing the capital city of the United States, Washington",http://vocab.getty.edu/tgn/7015717,http://www.wikidata.org/entity/Q3551781
12,England,Surrey,Surrey,Surrey,,,,counties,"Comprises river valleys, chalk hills, and lowlands; sheep-raising center in Middle Ages, market and wool center in 16th century; from 1801 until WW II, area became dense with railways and suburban growth; after WW II, preservation of countryside was enforced.",county of England,http://vocab.getty.edu/tgn/7008175,http://www.wikidata.org/entity/Q23276
12,Scotland,Fife,Fife,Fife,,,,unitary authorities,"Consists of former county of Fife; area comprises lowlands and fluvioglacial deposits with coalfields to the south; although remote during Middle Ages, contained many royal burghs and important centers during the 16th century; industries include mining and fishing.",,http://vocab.getty.edu/tgn/7008076,
12,United States,Montana,Montana,Montana,,,Montana,states,"Inhabited by Blackfoot, Sioux, Shoshone, Arapaho, Cheyenne, Flathead & others when French arrived 18th cen.; part came to USA in Louisiana Purchase 1803, conflict with Britain over N border settled in 1846; great influx of settlers came after Civil War.",state of the United States of America,http://vocab.getty.edu/tgn/7007524,http://www.wikidata.org/entity/Q1212
11,Canada,New Brunswick,New Brunswick,Province of New Brunswick,Nuovo Brunswick,,Province de Nouveau-Brunswick,provinces,"Largely forested area bordering Quebec and Maine, noted for pine, maple, birch, spruce, fir and tamarack trees; province also supports fishing and mining.",province of Canada,http://vocab.getty.edu/tgn/7005799,http://www.wikidata.org/entity/Q1965
11,Ireland,County Laois,Laois,County Laois,,,,counties,"The county of Laois in the province of Leinster in the Republic of Ireland includes the valleys of the upper Nore and upper Barrow Rivers, and most of the Slieve Bloom, a range of mountains. It measures some 664 square miles in area. It was annexed to the English crown under the reign of Edward VI, 1547-1553. It is characterized by small towns and villages dependent upon cattle raising, forestry, wool, and pharmaceutical manufacturing. The 2003 estimated population was 59,800.",,http://vocab.getty.edu/tgn/7007169,
11,Spain,Lleida,Lleida,,,,,provinces,"Borders France & Andorra; scenic valleys & forests of Pyrenees lie in N, with irrigated plain located in S; trades wine, wool, timber & cattle; exports pears & lemons; industry is mostly centered in Lérida city.",,http://vocab.getty.edu/tgn/7008912,
10,Australia,SA,South Australia,South Australia,,Südaustralien,Australie-Méridionale,states,"First European sighting 1627 (Thyssen); British province 1836; included with N Territory 1863-1901; vote given to women 1894; agricultural & mining region producing grains, fruit, wine, iron ore, limestone, opal; capital & main city is Adelaide.",state of Australia,http://vocab.getty.edu/tgn/7001831,http://www.wikidata.org/entity/Q35715
10,England,Cambridge,Cambridgeshire,Cambridgeshire,,,,counties,"Comprises low ridges, plains and former islands; crossed by rivers Nene and the Great Ouse; noted for archaeological sites (prehistoric tracks), Saxon churches and the university buildings of Cambridge; produces beets, potatoes, and fruit for canning.",,http://vocab.getty.edu/tgn/7011980,
10,Italy,Liguria,Liguria,Liguria,Liguria,Ligurien,Ligurie,regions,"Fertile coastal strip (Italian Riviera) and inland mountains; home to prehistoric Ligurii people, who inhabited Mediterranean coast from Rhône to Arno rivers; visited by Phoenicians & Greeks; taken by Rome 2nd cen. BCE; ruled by Genoa from 13th cen.",Italian region,http://vocab.getty.edu/tgn/7003236,http://www.wikidata.org/entity/Q1256
9,,Italy,,,,,,,,,,
9,England,Cambridgeshire,Cambridgeshire,Cambridgeshire,,,,counties,"Comprises low ridges, plains and former islands; crossed by rivers Nene and the Great Ouse; noted for archaeological sites (prehistoric tracks), Saxon churches and the university buildings of Cambridge; produces beets, potatoes, and fruit for canning.",,http://vocab.getty.edu/tgn/7011980,
9,England,Devonshire,Devon,Devon,,,,counties,"Comprises rocky plateaus, moors and lush river valleys; remains include prehistoric caves, Iron Age hill forts and Roman stations; first shired in 8th century; Danish raids 851-1003; tin mining was important 12th-17th centuries; iron, lead and copper mined until 19th century.",ceremonial county of England,http://vocab.getty.edu/tgn/7012077,http://www.wikidata.org/entity/Q23156
9,Italy,Bardonecchia,Bardonecchia,,,,,inhabited places,,Italian comune,http://vocab.getty.edu/tgn/1043412,http://www.wikidata.org/entity/Q9039
9,Italy,Como,Como,,,,,provinces,,province of Italy,http://vocab.getty.edu/tgn/7005852,http://www.wikidata.org/entity/Q16161
9,Switzerland,Ticino,Ticino,Ticino,Ticino,Kanton Tessin,Canton du Tessin,cantons,"Located in the Lepontine Alps; was part of Roman Transpadane Gaul; part of Lombardy until 15th century, when Swiss Confederation took area from Milan; ruled by Uri and Schwyz cantons until 1798.",canton of Switzerland,http://vocab.getty.edu/tgn/7004723,http://www.wikidata.org/entity/Q12724
8,,North Carolina,North Carolina,North Carolina,Carolina del Nord,,Caroline du Nord,states,"Inhabited since 14,000 BCE; Catawba, Cherokee and others were here when Europeans arrived 16th-17th cen., last group was forced out in 1830s; had internal strife due to divided loyalties during the American Revolution; joined the Confederacy in Civil War.",state of the United States of America,http://vocab.getty.edu/tgn/7007709,http://www.wikidata.org/entity/Q1454
8,England,Cornwall,Cornwall,Cornwall,,,,counties,"Most remote of country's counties, it remained Celtic and Cornish language was spoken until late 19th century; inhabited since prehistoric times and important for tin, clay, and granite; an earldom under William the Conqueror 1066; it is the oldest duchy in England, created by Edward III in 1337 for his eldest son, Edward the Black Prince.",,http://vocab.getty.edu/tgn/7008116,
8,England,"Jersey, Channel Islands",Jersey,Jersey,Jersey,Jersey,Jersey,dependent states,"Comprises Jersey island and several smaller islands; inhabited in Paleolithic times, and had Neolithic and Bronze Age settlements; ruled by diocese of Coutances in the 11th century, by Norman landowners in the 12th century; became politically separate from Normandy in 1204; official language is French, though English and a Norman-French patois are also spoken.",British Crown dependency in the Channel Islands,http://vocab.getty.edu/tgn/7005238,http://www.wikidata.org/entity/Q785
8,England,Suffolk,Suffolk,Suffolk,,,,counties,"Comprises sandy beaches, craggy cliffs, and deep estuaries; occupied during prehistoric  and Roman times; formed part of kingdom of East-Anglia from 5th-9th century; has been mostly agricultural since the 18th century; known for large Suffolk draft horses; currenty the county is divided into seven districts.",,http://vocab.getty.edu/tgn/7008185,
8,Italy,Abruzzi,Abruzzi,Abruzzo,Abruzzi,Abruzzen,Abruzzes,regions,"Region in central Italy, the most mountainous in the Italian Apennines; populated since Paleolithic times; Roman from 304 BCE; part of Lombard duchy of Spoleto 6th-11th centuries CE; part of kingdom of Naples 1266-1860.",region in Italy,http://vocab.getty.edu/tgn/7009084,http://www.wikidata.org/entity/Q1284
7,Canada,Québec,Québec,Quebec,,,Province du Québec,provinces,"Originally inhabited by Algonkin, Montagnais and Cree Indians; Eskimos later settled in Hudson Bay area; region declared for France by Jacques Cartier who landed at Gaspé 1534; settlement of colony of New France commenced at present Québec City 1608.",,http://vocab.getty.edu/tgn/7005804,
7,England,Durham,Durham,Durham,,,,counties,"Administrative, geographic, and historic county in northeastern England on the North Sea coast. It comprises two upland regions, lowlands of Wear valley, and limestone plateaus. The administrative county comprises seven districts: Chester-le-Street, Derwentside, the city of Durham, Easington, the borough of Sedgefield, Teesdale, and Wear Valley. The geographic county includes the entire administrative county, the unitary authorities of Darlington and Hartlepool, and the part of the unitary authority of Stockton-on-Tees (including the historic core of Stockton) north of the River Tees. The historic county includes the entire geographic county except for the part of the Teesdale district south of the River Tees, which belongs to the historic county of Yorkshire. The metropolitan boroughs of Gateshead, South Tyneside, and Sunderland in the metropolitan county of Tyne and Wear also belong to the historic county of Durham. The region was inhabited by agricultural peoples from Neolithic times through the Iron Age. Durham was incorporated into the Saxon kingdom of Northumbria during the 6th century. The region became important economically when it became a center for coal-mining and other heavy industry in the 19th century. Durham county was the site of the world's first passenger railway, which began running between Stockton and Darlington in 1825. The county suffered economic depression between World Wars I and II.",,http://vocab.getty.edu/tgn/7008127,
7,England,Gloucestershire,Gloucestershire,Gloucestershire,,,,counties,"Bisected by River Severn and comprises scenic woodlands valleys; occupied by prehistoric peoples, Romans and the Saxon Hwicce tribe; site of English-Welsh border disputes during Middle Ages; Cotswold area is famous for its wool.",,http://vocab.getty.edu/tgn/7008132,
